{
  "run_id": "run-002-intermediate-gym-strength-injury",
  "phase": "architecture",
  "produced_by": "program-architect",
  "version": 1,
  "status": "validated",
  "created_at": "2026-02-03T09:11:35+00:00",
  "payload": {
    "split_type": "upper_lower",
    "weeks_total": 10,
    "sessions": [
      {
        "session_id": "day1",
        "day_label": "Day 1 — Upper A",
        "focus": "Horizontal Push + Pull + Accessory",
        "target_minutes": 55,
        "movement_patterns": ["push", "pull", "accessory"]
      },
      {
        "session_id": "day2",
        "day_label": "Day 2 — Lower A",
        "focus": "Squat + Hinge + Core",
        "target_minutes": 55,
        "movement_patterns": ["squat", "hinge", "core"]
      },
      {
        "session_id": "day3",
        "day_label": "Day 3 — Upper B",
        "focus": "Push + Pull + Accessory",
        "target_minutes": 55,
        "movement_patterns": ["push", "pull", "accessory"]
      },
      {
        "session_id": "day4",
        "day_label": "Day 4 — Lower B",
        "focus": "Squat + Hinge + Core",
        "target_minutes": 55,
        "movement_patterns": ["squat", "hinge", "core"]
      }
    ],
    "periodization_notes": "Upper/lower x2 per week fits a 4-day intermediate strength program well: each pattern gets 2x/week frequency with enough recovery between repeats. Load trends up across weeks 1-9 on main lifts, with a deload in week 6; week 10 is a final peak week before re-testing.",
    "research_citations": []
  }
}
