{
  "run_id": "run-001-beginner-home-fatloss",
  "phase": "architecture",
  "produced_by": "program-architect",
  "version": 1,
  "status": "validated",
  "created_at": "2026-01-15T14:32:15+00:00",
  "payload": {
    "split_type": "full_body",
    "weeks_total": 8,
    "sessions": [
      {
        "session_id": "day1",
        "day_label": "Day 1 — Full Body A",
        "focus": "Squat + Push + Pull + Core",
        "target_minutes": 35,
        "movement_patterns": ["squat", "push", "pull", "core"]
      },
      {
        "session_id": "day2",
        "day_label": "Day 2 — Full Body B",
        "focus": "Hinge + Push + Core + Accessory",
        "target_minutes": 35,
        "movement_patterns": ["hinge", "push", "core", "accessory"]
      },
      {
        "session_id": "day3",
        "day_label": "Day 3 — Full Body C",
        "focus": "Squat + Pull + Hinge + Core",
        "target_minutes": 35,
        "movement_patterns": ["squat", "pull", "hinge", "core"]
      }
    ],
    "periodization_notes": "Full-body sessions 3x/week suit a true beginner training for fat loss: each movement pattern gets 2x/week frequency, which beats a split in the first 2-3 months. Volume trends up gradually weeks 1-5, a deload in week 6 manages fatigue going into the final push, weeks 7-8 slightly exceed the pre-deload volume.",
    "research_citations": []
  }
}
