{
  "run_id": "run-20261002-170239-dtxn",
  "phase": "architecture",
  "produced_by": "program-architect",
  "version": 1,
  "status": "draft",
  "created_at": "2026-10-02T17:10:00+00:00",
  "payload": {
    "split_type": "Full-body (3 non-consecutive days: Tue/Thu/Sat)",
    "weeks_total": 8,
    "sessions": [
      {
        "session_id": "day1",
        "day_label": "Day 1 (Tuesday) - Full Body A",
        "focus": "Full body, push and hinge emphasis; shallow-range knee-dominant work only (knee-safe)",
        "target_minutes": 35,
        "movement_patterns": ["push", "hinge", "squat", "core"]
      },
      {
        "session_id": "day2",
        "day_label": "Day 2 (Thursday) - Full Body B",
        "focus": "Full body, pull and single-leg/hip emphasis; loaded carry for conditioning (knee-safe)",
        "target_minutes": 35,
        "movement_patterns": ["pull", "hinge", "carry", "core"]
      },
      {
        "session_id": "day3",
        "day_label": "Day 3 (Saturday) - Full Body C",
        "focus": "Full body, balanced push/pull with higher-density circuit-style finish for energy expenditure",
        "target_minutes": 35,
        "movement_patterns": ["push", "pull", "squat", "core", "accessory"]
      }
    ],
    "periodization_notes": "Weeks 1-2 introduce movement patterns at moderate effort with ample reps in reserve; weeks 3-6 add volume then load progressively (linear progression); week 7 is peak effort and week 8 is a lighter consolidation/deload. Keep knee flexion shallow-to-moderate throughout and use shorter rest or circuit density, rather than deeper ranges, to raise energy expenditure for fat loss.",
    "research_citations": []
  }
}
